{
  "schema": "qlkg-retrieval-plan-v1",
  "question": "How does the synthetic theorem depend on its premise?",
  "namespace": "personal",
  "identity_queries": ["synthetic theorem"],
  "lexical_queries": ["synthetic theorem premise"],
  "semantic_queries": ["Explain the dependency of the synthetic theorem."],
  "graph": {
    "seed_ids": ["synthetic-theorem"],
    "edge_types": ["prerequisite-for", "derived-from"],
    "direction": "both",
    "max_depth": 1,
    "strategy": "hybrid"
  },
  "filters": {
    "node_types": ["knowledge"],
    "include_stale": false,
    "include_orphaned": false
  },
  "limit": 20
}
